{
  "schemaVersion": "1.0",
  "id": "artver_site_photo_1",
  "artifactId": "art_site_photo",
  "version": 1,
  "source": {
    "type": "object",
    "objectId": "obj_9384",
    "filename": "site.jpg",
    "mediaType": "image/jpeg",
    "size": 2450933,
    "storageProvider": "primary"
  },
  "integrity": {
    "algorithm": "sha256",
    "hash": "0155ca2b68de2f9404959609e36baaedbe8c23fcf451d6a8606e36f4e60a6308",
    "size": 2450933,
    "verifiedAt": "2026-08-15T10:00:02Z"
  },
  "createdBy": {
    "type": "field_agent",
    "id": "agent_7"
  },
  "createdAt": "2026-08-15T10:00:00Z"
}
